<?xml version="1.0" encoding="utf-8"?>

<surveys  xmlns:xsi="http://www.w3.org/2001/XMLSchema-instance"
          xsi:noNamespaceSchemaLocation="../../survey.xsd">
    <survey sid="1">
        <title>Spokojnosť s FI</title>
        <description>Tento dotazník je určený pre študentov FI a má dopomôcť k skvalitneniu štúdia.</description>
        <questions>
            <question qid="1" type="closed">
                <description>Ako ste spokojný so štúdiom na FI?</description>
                <answers>
                    <answer aid="1">Veľmi spokojný</answer>
                    <answer aid="2">Spokojný</answer>
                    <answer aid="3">Neutrálny</answer>
                    <answer aid="4">Nespokojný</answer>
                    <answer aid="5">Vôbec nespokojný</answer>
                </answers>
            </question>
        </questions>
    </survey>
    <survey sid="2">
        <title>Predmetová anketa predmetu PB138</title>
        <description>Tento dotazník má dopomôcť k skvaliteniu prednášok a cvičení predmetu PB138.</description>
        <questions>
            <question qid="1" type="closed">
                <description>Ako hodnotíte prednášky na predmete?</description>
                <answers>
                    <answer aid="1">Veľmi kvalitné</answer>
                    <answer aid="2">Kvalitné</answer>
                    <answer aid="3">Vylepšil by som ich</answer>
                    <answer aid="4">Nekvalitné</answer>
                    <answer aid="5">Úplne nekvalitné</answer>
                </answers>
            </question>
        </questions>
    </survey>
</surveys>
